source_url,note_id,xsec_source,cursor_score,items.0.id,items.0.model_type,items.0.note_card.user.user_id,items.0.note_card.user.nickname,items.0.note_card.user.avatar,items.0.note_card.user.xsec_token,items.0.note_card.tag_list.0.id,items.0.note_card.tag_list.0.name,items.0.note_card.tag_list.0.type,items.0.note_card.tag_list.1.id,items.0.note_card.tag_list.1.name,items.0.note_card.tag_list.1.type,items.0.note_card.tag_list.2.id,items.0.note_card.tag_list.2.name,items.0.note_card.tag_list.2.type,items.0.note_card.tag_list.3.name,items.0.note_card.tag_list.3.type,items.0.note_card.tag_list.3.id,items.0.note_card.tag_list.4.id,items.0.note_card.tag_list.4.name,items.0.note_card.tag_list.4.type,items.0.note_card.tag_list.5.id,items.0.note_card.tag_list.5.name,items.0.note_card.tag_list.5.type,items.0.note_card.tag_list.6.id,items.0.note_card.tag_list.6.name,items.0.note_card.tag_list.6.type,items.0.note_card.tag_list.7.id,items.0.note_card.tag_list.7.name,items.0.note_card.tag_list.7.type,items.0.note_card.tag_list.8.type,items.0.note_card.tag_list.8.id,items.0.note_card.tag_list.8.name,items.0.note_card.tag_list.9.id,items.0.note_card.tag_list.9.name,items.0.note_card.tag_list.9.type,items.0.note_card.at_user_list,items.0.note_card.time,items.0.note_card.last_update_time,items.0.note_card.type,items.0.note_card.title,items.0.note_card.desc,items.0.note_card.ip_location,items.0.note_card.share_info.un_share,items.0.note_card.note_id,items.0.note_card.interact_info.liked_count,items.0.note_card.interact_info.collected,items.0.note_card.interact_info.collected_count,items.0.note_card.interact_info.comment_count,items.0.note_card.interact_info.share_count,items.0.note_card.interact_info.followed,items.0.note_card.interact_info.relation,items.0.note_card.interact_info.liked,items.0.note_card.image_list.0.info_list.0.image_scene,items.0.note_card.image_list.0.info_list.0.url,items.0.note_card.image_list.0.info_list.1.image_scene,items.0.note_card.image_list.0.info_list.1.url,items.0.note_card.image_list.0.stream.av1,items.0.note_card.image_list.0.stream.h264.0.master_url,items.0.note_card.image_list.0.stream.h264.0.backup_urls.0,items.0.note_card.image_list.0.stream.h265,items.0.note_card.image_list.0.stream.h266,items.0.note_card.image_list.0.trace_id,items.0.note_card.image_list.0.url_pre,items.0.note_card.image_list.0.url_default,items.0.note_card.image_list.0.live_photo,items.0.note_card.image_list.0.file_id,items.0.note_card.image_list.0.height,items.0.note_card.image_list.0.width,items.0.note_card.image_list.0.url,items.0.note_card.image_list.1.height,items.0.note_card.image_list.1.width,items.0.note_card.image_list.1.stream.h264.0.master_url,items.0.note_card.image_list.1.stream.h264.0.backup_urls.0,items.0.note_card.image_list.1.stream.h265,items.0.note_card.image_list.1.stream.h266,items.0.note_card.image_list.1.stream.av1,items.0.note_card.image_list.1.url_pre,items.0.note_card.image_list.1.url_default,items.0.note_card.image_list.1.live_photo,items.0.note_card.image_list.1.file_id,items.0.note_card.image_list.1.url,items.0.note_card.image_list.1.trace_id,items.0.note_card.image_list.1.info_list.0.image_scene,items.0.note_card.image_list.1.info_list.0.url,items.0.note_card.image_list.1.info_list.1.image_scene,items.0.note_card.image_list.1.info_list.1.url,items.0.note_card.image_list.2.url,items.0.note_card.image_list.2.live_photo,items.0.note_card.image_list.2.file_id,items.0.note_card.image_list.2.width,items.0.note_card.image_list.2.info_list.0.image_scene,items.0.note_card.image_list.2.info_list.0.url,items.0.note_card.image_list.2.info_list.1.url,items.0.note_card.image_list.2.info_list.1.image_scene,items.0.note_card.image_list.2.url_pre,items.0.note_card.image_list.2.url_default,items.0.note_card.image_list.2.stream.h264.0.master_url,items.0.note_card.image_list.2.stream.h264.0.backup_urls.0,items.0.note_card.image_list.2.stream.h265,items.0.note_card.image_list.2.stream.h266,items.0.note_card.image_list.2.stream.av1,items.0.note_card.image_list.2.height,items.0.note_card.image_list.2.trace_id,items.0.note_card.image_list.3.url,items.0.note_card.image_list.3.info_list.0.url,items.0.note_card.image_list.3.info_list.0.image_scene,items.0.note_card.image_list.3.info_list.1.image_scene,items.0.note_card.image_list.3.info_list.1.url,items.0.note_card.image_list.3.url_pre,items.0.note_card.image_list.3.height,items.0.note_card.image_list.3.width,items.0.note_card.image_list.3.url_default,items.0.note_card.image_list.3.stream.h264.0.master_url,items.0.note_card.image_list.3.stream.h264.0.backup_urls.0,items.0.note_card.image_list.3.stream.h265,items.0.note_card.image_list.3.stream.h266,items.0.note_card.image_list.3.stream.av1,items.0.note_card.image_list.3.live_photo,items.0.note_card.image_list.3.file_id,items.0.note_card.image_list.3.trace_id,items.0.note_card.image_list.4.url_pre,items.0.note_card.image_list.4.live_photo,items.0.note_card.image_list.4.info_list.0.image_scene,items.0.note_card.image_list.4.info_list.0.url,items.0.note_card.image_list.4.info_list.1.image_scene,items.0.note_card.image_list.4.info_list.1.url,items.0.note_card.image_list.4.url_default,items.0.note_card.image_list.4.stream.av1,items.0.note_card.image_list.4.stream.h264.0.master_url,items.0.note_card.image_list.4.stream.h264.0.backup_urls.0,items.0.note_card.image_list.4.stream.h265,items.0.note_card.image_list.4.stream.h266,items.0.note_card.image_list.4.file_id,items.0.note_card.image_list.4.height,items.0.note_card.image_list.4.width,items.0.note_card.image_list.4.url,items.0.note_card.image_list.4.trace_id,items.0.note_card.image_list.5.file_id,items.0.note_card.image_list.5.width,items.0.note_card.image_list.5.url,items.0.note_card.image_list.5.url_pre,items.0.note_card.image_list.5.url_default,items.0.note_card.image_list.5.height,items.0.note_card.image_list.5.trace_id,items.0.note_card.image_list.5.info_list.0.image_scene,items.0.note_card.image_list.5.info_list.0.url,items.0.note_card.image_list.5.info_list.1.image_scene,items.0.note_card.image_list.5.info_list.1.url,items.0.note_card.image_list.5.stream.av1,items.0.note_card.image_list.5.stream.h264.0.master_url,items.0.note_card.image_list.5.stream.h264.0.backup_urls.0,items.0.note_card.image_list.5.stream.h265,items.0.note_card.image_list.5.stream.h266,items.0.note_card.image_list.5.live_photo,items.0.note_card.image_list.6.width,items.0.note_card.image_list.6.url,items.0.note_card.image_list.6.info_list.0.image_scene,items.0.note_card.image_list.6.info_list.0.url,items.0.note_card.image_list.6.info_list.1.image_scene,items.0.note_card.image_list.6.info_list.1.url,items.0.note_card.image_list.6.url_default,items.0.note_card.image_list.6.live_photo,items.0.note_card.image_list.6.file_id,items.0.note_card.image_list.6.height,items.0.note_card.image_list.6.trace_id,items.0.note_card.image_list.6.url_pre,items.0.note_card.image_list.6.stream.h265,items.0.note_card.image_list.6.stream.h266,items.0.note_card.image_list.6.stream.av1,items.0.note_card.image_list.6.stream.h264.0.master_url,items.0.note_card.image_list.6.stream.h264.0.backup_urls.0,items.0.note_card.image_list.7.width,items.0.note_card.image_list.7.trace_id,items.0.note_card.image_list.7.stream.h264.0.master_url,items.0.note_card.image_list.7.stream.h264.0.backup_urls.0,items.0.note_card.image_list.7.stream.h265,items.0.note_card.image_list.7.stream.h266,items.0.note_card.image_list.7.stream.av1,items.0.note_card.image_list.7.live_photo,items.0.note_card.image_list.7.height,items.0.note_card.image_list.7.url,items.0.note_card.image_list.7.info_list.0.image_scene,items.0.note_card.image_list.7.info_list.0.url,items.0.note_card.image_list.7.info_list.1.image_scene,items.0.note_card.image_list.7.info_list.1.url,items.0.note_card.image_list.7.url_pre,items.0.note_card.image_list.7.url_default,items.0.note_card.image_list.7.file_id,items.0.note_card.image_list.8.trace_id,items.0.note_card.image_list.8.info_list.0.image_scene,items.0.note_card.image_list.8.info_list.0.url,items.0.note_card.image_list.8.info_list.1.image_scene,items.0.note_card.image_list.8.info_list.1.url,items.0.note_card.image_list.8.stream.h266,items.0.note_card.image_list.8.stream.av1,items.0.note_card.image_list.8.stream.h264.0.backup_urls.0,items.0.note_card.image_list.8.stream.h264.0.master_url,items.0.note_card.image_list.8.stream.h265,items.0.note_card.image_list.8.live_photo,items.0.note_card.image_list.8.file_id,items.0.note_card.image_list.8.height,items.0.note_card.image_list.8.width,items.0.note_card.image_list.8.url,items.0.note_card.image_list.8.url_pre,items.0.note_card.image_list.8.url_default,items.0.note_card.image_list.9.width,items.0.note_card.image_list.9.url,items.0.note_card.image_list.9.trace_id,items.0.note_card.image_list.9.info_list.0.image_scene,items.0.note_card.image_list.9.info_list.0.url,items.0.note_card.image_list.9.info_list.1.image_scene,items.0.note_card.image_list.9.info_list.1.url,items.0.note_card.image_list.9.file_id,items.0.note_card.image_list.9.height,items.0.note_card.image_list.9.url_pre,items.0.note_card.image_list.9.url_default,items.0.note_card.image_list.9.stream.av1,items.0.note_card.image_list.9.stream.h264.0.master_url,items.0.note_card.image_list.9.stream.h264.0.backup_urls.0,items.0.note_card.image_list.9.stream.h265,items.0.note_card.image_list.9.stream.h266,items.0.note_card.image_list.9.live_photo,items.0.note_card.image_list.10.width,items.0.note_card.image_list.10.stream.h265,items.0.note_card.image_list.10.stream.h266,items.0.note_card.image_list.10.stream.av1,items.0.note_card.image_list.10.stream.h264.0.master_url,items.0.note_card.image_list.10.stream.h264.0.backup_urls.0,items.0.note_card.image_list.10.file_id,items.0.note_card.image_list.10.height,items.0.note_card.image_list.10.url,items.0.note_card.image_list.10.trace_id,items.0.note_card.image_list.10.info_list.0.image_scene,items.0.note_card.image_list.10.info_list.0.url,items.0.note_card.image_list.10.info_list.1.image_scene,items.0.note_card.image_list.10.info_list.1.url,items.0.note_card.image_list.10.url_pre,items.0.note_card.image_list.10.url_default,items.0.note_card.image_list.10.live_photo,items.0.note_card.image_list.11.stream.h264.0.master_url,items.0.note_card.image_list.11.stream.h264.0.backup_urls.0,items.0.note_card.image_list.11.stream.h265,items.0.note_card.image_list.11.stream.h266,items.0.note_card.image_list.11.stream.av1,items.0.note_card.image_list.11.live_photo,items.0.note_card.image_list.11.url_pre,items.0.note_card.image_list.11.url_default,items.0.note_card.image_list.11.width,items.0.note_card.image_list.11.url,items.0.note_card.image_list.11.trace_id,items.0.note_card.image_list.11.info_list.0.image_scene,items.0.note_card.image_list.11.info_list.0.url,items.0.note_card.image_list.11.info_list.1.image_scene,items.0.note_card.image_list.11.info_list.1.url,items.0.note_card.image_list.11.file_id,items.0.note_card.image_list.11.height,current_time,raw_json,media_enrichment.image_count,media_enrichment.transcript_source_count,media_enrichment.image_ocr_text,media_enrichment.video_transcript,media_enrichment.errors
https://www.xiaohongshu.com/discovery/item/6a3bac69000000000f028ff2?source=webshare&xhsshare=pc_web&xsec_token=CBTr9vMwm2qpMsrmCv_7VkYv6ZtOZJPJ9OeHp7T116G1w=&xsec_source=pc_share,6a3bac69000000000f028ff2,pc_share,,6a3bac69000000000f028ff2,note,5d32825f0000000016032242,瓜瓜椰,https://sns-avatar-qc.xhscdn.com/avatar/1040g2jo314t4o6args005n9ig9flm8i2hskph10,ABc1-sHK4x9SXdPlzAgnpbQ5hfms-K5rcC-W4Q9qEh-T4=,5cc4741b000000000d019854,plog,topic,6a1f8cd2000000000601079e,杭州下沙滴滴小巴,topic,66628bc2000000000202fda0,小红书校园日记,topic,下沙,topic,5bf389be0a813f0001e4837c,5bf21fc34e61ca00015a5358,研究生日常,topic,60d0f70e000000000100458b,生活是个动词,topic,64dc8d6d000000001a014dbd,生动比漂亮更重要,topic,64c1f306000000003801ba06,镜头反转记录自己,topic,topic,53cf2127b4c4d63cbb02040f,可爱,65a5f39f000000003f03e3fd,喜欢的照片当然要慢慢发,topic,[],1782299128000,1782295944000,normal,浙大研二｜努力探索杭州地图ing🗺️,"周末的时候去下沙大学城那边溜达了
和朋友泡在下沙各个小店☕️
从校门口小吃街逛到网红咖啡店
返程玩的太累太晚了，不想挤公交了
解锁了新载具：全橘色的滴滴小巴🚌
价格超便宜！只要 3/人
完全惊到我们
两个抠搜小女孩直接美美坐上哈哈哈哈哈！
	
新奇的滴滴小巴很方便！
打开滴滴app，首页就能看到滴滴小巴，点进去就能叫车！
完全“滴滴拼大车”来着，3️⃣r/人坐7座商务车超宽敞💺
体验感可以给到夯！
坐车路上和好朋友叽叽喳喳复盘一整天的快乐
也不用计较路费，想逛多久逛多久😽
好羡慕下沙大学城的宝宝们
跨校区找朋友、出门探店都毫无压力
低成本实现好友见面自由！🫶
下沙的宝宝们有体验过么？
没有的话真的超推荐感受下！
#plog[话题]# #杭州下沙滴滴小巴[话题]# #小红书校园日记[话题]# #下沙[话题]# #研究生日常[话题]# #生活是个动词[话题]# #生动比漂亮更重要[话题]# #镜头反转记录自己[话题]# #可爱[话题]# #喜欢的照片当然要慢慢发[话题]#",浙江,False,6a3bac69000000000f028ff2,65,False,12,25,3,False,none,False,WB_PRV,http://sns-webpic-qc.xhscdn.com/202606250933/1a430a507775e42a2c75cc2ab678b7de/notes_pre_post/1040g3k0321puvbl5n40g5n9ig9flm8i20ucida0!nd_prv_wlteh_webp_3,WB_DFT,http://sns-webpic-qc.xhscdn.com/202606250933/2076be0d0d1112ecd3288fadeb550d1b/notes_pre_post/1040g3k0321puvbl5n40g5n9ig9flm8i20ucida0!nd_dft_wlteh_webp_3,[],http://sns-video-v6.xhscdn.com/stream/1/10/19/01ea3bac5f3a6c3c010050039ef91e3167_19.mp4?sign=76a15ba28422a2732ecef51b145a5027&t=6a41228e,http://sns-bak-v1.xhscdn.com/stream/1/10/19/01ea3bac5f3a6c3c010050039ef91e3167_19.mp4,[],[],,http://sns-webpic-qc.xhscdn.com/202606250933/1a430a507775e42a2c75cc2ab678b7de/notes_pre_post/1040g3k0321puvbl5n40g5n9ig9flm8i20ucida0!nd_prv_wlteh_webp_3,http://sns-webpic-qc.xhscdn.com/202606250933/2076be0d0d1112ecd3288fadeb550d1b/notes_pre_post/1040g3k0321puvbl5n40g5n9ig9flm8i20ucida0!nd_dft_wlteh_webp_3,True,notes_pre_post/1040g3k0321puvbl5n40g5n9ig9flm8i20ucida0,2560,1920,,1924,1440,http://sns-video-v6.xhscdn.com/stream/1/10/19/01ea3bac613142db010050039ef91df118_19.mp4?sign=72f90ac89f863083d3c4be346501b614&t=6a41228e,http://sns-bak-v1.xhscdn.com/stream/1/10/19/01ea3bac613142db010050039ef91df118_19.mp4,[],[],[],http://sns-webpic-qc.xhscdn.com/202606250933/29d65ccc49768c4b1159b0280e0c9131/notes_pre_post/1040g3k0321puvbl5n4105n9ig9flm8i2sg3jtj8!nd_prv_wlteh_webp_3,http://sns-webpic-qc.xhscdn.com/202606250933/211a4433575b7ae9e79409cc2ed4db4a/notes_pre_post/1040g3k0321puvbl5n4105n9ig9flm8i2sg3jtj8!nd_dft_wlteh_webp_3,True,notes_pre_post/1040g3k0321puvbl5n4105n9ig9flm8i2sg3jtj8,,,WB_PRV,http://sns-webpic-qc.xhscdn.com/202606250933/29d65ccc49768c4b1159b0280e0c9131/notes_pre_post/1040g3k0321puvbl5n4105n9ig9flm8i2sg3jtj8!nd_prv_wlteh_webp_3,WB_DFT,http://sns-webpic-qc.xhscdn.com/202606250933/211a4433575b7ae9e79409cc2ed4db4a/notes_pre_post/1040g3k0321puvbl5n4105n9ig9flm8i2sg3jtj8!nd_dft_wlteh_webp_3,,True,notes_pre_post/1040g3k0321puvbl5n41g5n9ig9flm8i2ii254ug,1920,WB_PRV,http://sns-webpic-qc.xhscdn.com/202606250933/50e4c917d3e22f74267395617e89bec0/notes_pre_post/1040g3k0321puvbl5n41g5n9ig9flm8i2ii254ug!nd_prv_wlteh_webp_3,http://sns-webpic-qc.xhscdn.com/202606250933/fde2871ef16af35c4659e9b2c0811241/notes_pre_post/1040g3k0321puvbl5n41g5n9ig9flm8i2ii254ug!nd_dft_wlteh_webp_3,WB_DFT,http://sns-webpic-qc.xhscdn.com/202606250933/50e4c917d3e22f74267395617e89bec0/notes_pre_post/1040g3k0321puvbl5n41g5n9ig9flm8i2ii254ug!nd_prv_wlteh_webp_3,http://sns-webpic-qc.xhscdn.com/202606250933/fde2871ef16af35c4659e9b2c0811241/notes_pre_post/1040g3k0321puvbl5n41g5n9ig9flm8i2ii254ug!nd_dft_wlteh_webp_3,http://sns-video-v6.xhscdn.com/stream/1/10/19/01ea3bac6238cda8010050039ef91e08d4_19.mp4?sign=218b35813779cde72b11d28d8dc5231d&t=6a41228e,http://sns-bak-v1.xhscdn.com/stream/1/10/19/01ea3bac6238cda8010050039ef91e08d4_19.mp4,[],[],[],2560,,,http://sns-webpic-qc.xhscdn.com/202606250933/fd02735e7f4ac1b87e3ba3790dd33a4d/notes_pre_post/1040g3k0321puvbl5n4205n9ig9flm8i27uu4im0!nd_prv_wlteh_webp_3,WB_PRV,WB_DFT,http://sns-webpic-qc.xhscdn.com/202606250933/ce0629e0600a1ea7b18f807c6a8791d7/notes_pre_post/1040g3k0321puvbl5n4205n9ig9flm8i27uu4im0!nd_dft_wlteh_webp_3,http://sns-webpic-qc.xhscdn.com/202606250933/fd02735e7f4ac1b87e3ba3790dd33a4d/notes_pre_post/1040g3k0321puvbl5n4205n9ig9flm8i27uu4im0!nd_prv_wlteh_webp_3,2560,1920,http://sns-webpic-qc.xhscdn.com/202606250933/ce0629e0600a1ea7b18f807c6a8791d7/notes_pre_post/1040g3k0321puvbl5n4205n9ig9flm8i27uu4im0!nd_dft_wlteh_webp_3,http://sns-video-v6.xhscdn.com/stream/1/10/19/01ea3bac5d314165010050039ef91dfdbc_19.mp4?sign=996aa8fd5ff16b1231b4d1bc3f673657&t=6a41228e,http://sns-bak-v1.xhscdn.com/stream/1/10/19/01ea3bac5d314165010050039ef91dfdbc_19.mp4,[],[],[],True,notes_pre_post/1040g3k0321puvbl5n4205n9ig9flm8i27uu4im0,,http://sns-webpic-qc.xhscdn.com/202606250933/54d1f6c69549d08e247206e2e0bcc74f/notes_pre_post/1040g3k0321puvbl5n42g5n9ig9flm8i2p1fp9go!nd_prv_wlteh_webp_3,True,WB_PRV,http://sns-webpic-qc.xhscdn.com/202606250933/54d1f6c69549d08e247206e2e0bcc74f/notes_pre_post/1040g3k0321puvbl5n42g5n9ig9flm8i2p1fp9go!nd_prv_wlteh_webp_3,WB_DFT,http://sns-webpic-qc.xhscdn.com/202606250933/c5defb8b1ae170bc269847910f9d8157/notes_pre_post/1040g3k0321puvbl5n42g5n9ig9flm8i2p1fp9go!nd_dft_wlteh_webp_3,http://sns-webpic-qc.xhscdn.com/202606250933/c5defb8b1ae170bc269847910f9d8157/notes_pre_post/1040g3k0321puvbl5n42g5n9ig9flm8i2p1fp9go!nd_dft_wlteh_webp_3,[],http://sns-video-v6.xhscdn.com/stream/1/10/19/01ea3bac63371740010050039ef91df999_19.mp4?sign=f22db551a9f6119bf5c88636a2d70530&t=6a41228e,http://sns-bak-v1.xhscdn.com/stream/1/10/19/01ea3bac63371740010050039ef91df999_19.mp4,[],[],notes_pre_post/1040g3k0321puvbl5n42g5n9ig9flm8i2p1fp9go,2560,1920,,,notes_pre_post/1040g3k0321puvbl5n4305n9ig9flm8i2p757320,1920,,http://sns-webpic-qc.xhscdn.com/202606250933/3d203eff5d9f3099e4ce9381db4fae63/notes_pre_post/1040g3k0321puvbl5n4305n9ig9flm8i2p757320!nd_prv_wlteh_webp_3,http://sns-webpic-qc.xhscdn.com/202606250933/9382752d7ece51ced63c917145b0cda1/notes_pre_post/1040g3k0321puvbl5n4305n9ig9flm8i2p757320!nd_dft_wlteh_webp_3,2560,,WB_PRV,http://sns-webpic-qc.xhscdn.com/202606250933/3d203eff5d9f3099e4ce9381db4fae63/notes_pre_post/1040g3k0321puvbl5n4305n9ig9flm8i2p757320!nd_prv_wlteh_webp_3,WB_DFT,http://sns-webpic-qc.xhscdn.com/202606250933/9382752d7ece51ced63c917145b0cda1/notes_pre_post/1040g3k0321puvbl5n4305n9ig9flm8i2p757320!nd_dft_wlteh_webp_3,[],http://sns-video-v6.xhscdn.com/stream/1/10/19/01ea3bac64425b68010050039ef91df676_19.mp4?sign=2bd65b954d1641686c79a11d8aede345&t=6a41228e,http://sns-bak-v1.xhscdn.com/stream/1/10/19/01ea3bac64425b68010050039ef91df676_19.mp4,[],[],True,1920,,WB_PRV,http://sns-webpic-qc.xhscdn.com/202606250933/58cd3be1505e7ce7ee4fb100b15b1ba9/notes_pre_post/1040g3k0321puvbl5n43g5n9ig9flm8i2kp334a0!nd_prv_wlteh_webp_3,WB_DFT,http://sns-webpic-qc.xhscdn.com/202606250933/a2f06c0baa412d4ef68db56fcb86a4ba/notes_pre_post/1040g3k0321puvbl5n43g5n9ig9flm8i2kp334a0!nd_dft_wlteh_webp_3,http://sns-webpic-qc.xhscdn.com/202606250933/a2f06c0baa412d4ef68db56fcb86a4ba/notes_pre_post/1040g3k0321puvbl5n43g5n9ig9flm8i2kp334a0!nd_dft_wlteh_webp_3,True,notes_pre_post/1040g3k0321puvbl5n43g5n9ig9flm8i2kp334a0,2560,,http://sns-webpic-qc.xhscdn.com/202606250933/58cd3be1505e7ce7ee4fb100b15b1ba9/notes_pre_post/1040g3k0321puvbl5n43g5n9ig9flm8i2kp334a0!nd_prv_wlteh_webp_3,[],[],[],http://sns-video-v6.xhscdn.com/stream/1/10/19/01ea3bac65428395010050039ef91e0a93_19.mp4?sign=091efe754e751113b3cf9c39d324902a&t=6a41228e,http://sns-bak-v1.xhscdn.com/stream/1/10/19/01ea3bac65428395010050039ef91e0a93_19.mp4,1920,,http://sns-video-v6.xhscdn.com/stream/1/10/19/01ea3bac663a6f17010050039ef91df530_19.mp4?sign=8c36ce0b281031d5bdf4eecc92466e4a&t=6a41228e,http://sns-bak-v1.xhscdn.com/stream/1/10/19/01ea3bac663a6f17010050039ef91df530_19.mp4,[],[],[],True,2560,,WB_PRV,http://sns-webpic-qc.xhscdn.com/202606250933/e6fe2836ed186905ba5c9ccaa06a2f79/notes_pre_post/1040g3k0321puvbl5n4405n9ig9flm8i2gfq7c70!nd_prv_wlteh_webp_3,WB_DFT,http://sns-webpic-qc.xhscdn.com/202606250933/16e1512bb86f615ab0d46d163bae8f9e/notes_pre_post/1040g3k0321puvbl5n4405n9ig9flm8i2gfq7c70!nd_dft_wlteh_webp_3,http://sns-webpic-qc.xhscdn.com/202606250933/e6fe2836ed186905ba5c9ccaa06a2f79/notes_pre_post/1040g3k0321puvbl5n4405n9ig9flm8i2gfq7c70!nd_prv_wlteh_webp_3,http://sns-webpic-qc.xhscdn.com/202606250933/16e1512bb86f615ab0d46d163bae8f9e/notes_pre_post/1040g3k0321puvbl5n4405n9ig9flm8i2gfq7c70!nd_dft_wlteh_webp_3,notes_pre_post/1040g3k0321puvbl5n4405n9ig9flm8i2gfq7c70,,WB_PRV,http://sns-webpic-qc.xhscdn.com/202606250933/97be82760c0c7addfa3daa7d136f621c/notes_pre_post/1040g3k0321puvbl5n44g5n9ig9flm8i2h4ur3bg!nd_prv_wlteh_webp_3,WB_DFT,http://sns-webpic-qc.xhscdn.com/202606250933/2e68386503dfc029754fd154d2fa1c6f/notes_pre_post/1040g3k0321puvbl5n44g5n9ig9flm8i2h4ur3bg!nd_dft_wlteh_webp_3,[],[],http://sns-bak-v1.xhscdn.com/stream/1/10/19/01ea3bac663a6f7d010050039ef91df022_19.mp4,http://sns-video-v6.xhscdn.com/stream/1/10/19/01ea3bac663a6f7d010050039ef91df022_19.mp4?sign=7d8a1a9d5a59dd997831472f4fbe7a60&t=6a41228e,[],True,notes_pre_post/1040g3k0321puvbl5n44g5n9ig9flm8i2h4ur3bg,2560,1920,,http://sns-webpic-qc.xhscdn.com/202606250933/97be82760c0c7addfa3daa7d136f621c/notes_pre_post/1040g3k0321puvbl5n44g5n9ig9flm8i2h4ur3bg!nd_prv_wlteh_webp_3,http://sns-webpic-qc.xhscdn.com/202606250933/2e68386503dfc029754fd154d2fa1c6f/notes_pre_post/1040g3k0321puvbl5n44g5n9ig9flm8i2h4ur3bg!nd_dft_wlteh_webp_3,1264,,,WB_PRV,http://sns-webpic-qc.xhscdn.com/202606250933/deae5f2845417a5d7c20a10a037acdaf/notes_pre_post/1040g3k0321puvbl5n4505n9ig9flm8i2198uiqo!nd_prv_wlteh_webp_3,WB_DFT,http://sns-webpic-qc.xhscdn.com/202606250933/af8a19a50c8ad402e9a5ab75d77e811b/notes_pre_post/1040g3k0321puvbl5n4505n9ig9flm8i2198uiqo!nd_dft_wlteh_webp_3,notes_pre_post/1040g3k0321puvbl5n4505n9ig9flm8i2198uiqo,1688,http://sns-webpic-qc.xhscdn.com/202606250933/deae5f2845417a5d7c20a10a037acdaf/notes_pre_post/1040g3k0321puvbl5n4505n9ig9flm8i2198uiqo!nd_prv_wlteh_webp_3,http://sns-webpic-qc.xhscdn.com/202606250933/af8a19a50c8ad402e9a5ab75d77e811b/notes_pre_post/1040g3k0321puvbl5n4505n9ig9flm8i2198uiqo!nd_dft_wlteh_webp_3,[],http://sns-video-v6.xhscdn.com/stream/1/10/19/01ea3bac6734251a010050039ef91df038_19.mp4?sign=b1778ee1000cf37d8ca5bd849c60dfbf&t=6a41228e,http://sns-bak-v1.xhscdn.com/stream/1/10/19/01ea3bac6734251a010050039ef91df038_19.mp4,[],[],True,1920,[],[],[],http://sns-video-v6.xhscdn.com/stream/1/10/19/01ea3bac68342582010050039ef91df0cf_19.mp4?sign=fd7e6ee0540f9cce5abba477e4cf6667&t=6a41228e,http://sns-bak-v1.xhscdn.com/stream/1/10/19/01ea3bac68342582010050039ef91df0cf_19.mp4,notes_pre_post/1040g3k0321puvbl5n45g5n9ig9flm8i2v84aqi0,2560,,,WB_PRV,http://sns-webpic-qc.xhscdn.com/202606250933/4d3d46e928bbf59f31aa16b5bb0a6974/notes_pre_post/1040g3k0321puvbl5n45g5n9ig9flm8i2v84aqi0!nd_prv_wlteh_webp_3,WB_DFT,http://sns-webpic-qc.xhscdn.com/202606250933/21f198b697ca761a2ff1d9a396422b28/notes_pre_post/1040g3k0321puvbl5n45g5n9ig9flm8i2v84aqi0!nd_dft_wlteh_webp_3,http://sns-webpic-qc.xhscdn.com/202606250933/4d3d46e928bbf59f31aa16b5bb0a6974/notes_pre_post/1040g3k0321puvbl5n45g5n9ig9flm8i2v84aqi0!nd_prv_wlteh_webp_3,http://sns-webpic-qc.xhscdn.com/202606250933/21f198b697ca761a2ff1d9a396422b28/notes_pre_post/1040g3k0321puvbl5n45g5n9ig9flm8i2v84aqi0!nd_dft_wlteh_webp_3,True,http://sns-video-v6.xhscdn.com/stream/1/10/19/01ea3bac6938d04e010050039ef91dffda_19.mp4?sign=cd316a69d3b68045e5887254f5f356ab&t=6a41228e,http://sns-bak-v1.xhscdn.com/stream/1/10/19/01ea3bac6938d04e010050039ef91dffda_19.mp4,[],[],[],True,http://sns-webpic-qc.xhscdn.com/202606250933/b9aa425a97d60564d0496a34fc807c13/notes_pre_post/1040g3k0321puvbl5n4605n9ig9flm8i2dj1hk0g!nd_prv_wlteh_webp_3,http://sns-webpic-qc.xhscdn.com/202606250933/b373adca948c83233f40ff37e17dab15/notes_pre_post/1040g3k0321puvbl5n4605n9ig9flm8i2dj1hk0g!nd_dft_wlteh_webp_3,1920,,,WB_PRV,http://sns-webpic-qc.xhscdn.com/202606250933/b9aa425a97d60564d0496a34fc807c13/notes_pre_post/1040g3k0321puvbl5n4605n9ig9flm8i2dj1hk0g!nd_prv_wlteh_webp_3,WB_DFT,http://sns-webpic-qc.xhscdn.com/202606250933/b373adca948c83233f40ff37e17dab15/notes_pre_post/1040g3k0321puvbl5n4605n9ig9flm8i2dj1hk0g!nd_dft_wlteh_webp_3,notes_pre_post/1040g3k0321puvbl5n4605n9ig9flm8i2dj1hk0g,2560,1782351182979,"{""cursor_score"":"""",""items"":[{""id"":""6a3bac69000000000f028ff2"",""model_type"":""note"",""note_card"":{""user"":{""user_id"":""5d32825f0000000016032242"",""nickname"":""瓜瓜椰"",""avatar"":""https://sns-avatar-qc.xhscdn.com/avatar/1040g2jo314t4o6args005n9ig9flm8i2hskph10"",""xsec_token"":""ABc1-sHK4x9SXdPlzAgnpbQ5hfms-K5rcC-W4Q9qEh-T4=""},""tag_list"":[{""id"":""5cc4741b000000000d019854"",""name"":""plog"",""type"":""topic""},{""id"":""6a1f8cd2000000000601079e"",""name"":""杭州下沙滴滴小巴"",""type"":""topic""},{""id"":""66628bc2000000000202fda0"",""name"":""小红书校园日记"",""type"":""topic""},{""name"":""下沙"",""type"":""topic"",""id"":""5bf389be0a813f0001e4837c""},{""id"":""5bf21fc34e61ca00015a5358"",""name"":""研究生日常"",""type"":""topic""},{""id"":""60d0f70e000000000100458b"",""name"":""生活是个动词"",""type"":""topic""},{""id"":""64dc8d6d000000001a014dbd"",""name"":""生动比漂亮更重要"",""type"":""topic""},{""id"":""64c1f306000000003801ba06"",""name"":""镜头反转记录自己"",""type"":""topic""},{""type"":""topic"",""id"":""53cf2127b4c4d63cbb02040f"",""name"":""可爱""},{""id"":""65a5f39f000000003f03e3fd"",""name"":""喜欢的照片当然要慢慢发"",""type"":""topic""}],""at_user_list"":[],""time"":1782299128000,""last_update_time"":1782295944000,""type"":""normal"",""title"":""浙大研二｜努力探索杭州地图ing🗺️"",""desc"":""周末的时候去下沙大学城那边溜达了\n和朋友泡在下沙各个小店☕️\n从校门口小吃街逛到网红咖啡店\n返程玩的太累太晚了，不想挤公交了\n解锁了新载具：全橘色的滴滴小巴🚌\n价格超便宜！只要 3/人\n完全惊到我们\n两个抠搜小女孩直接美美坐上哈哈哈哈哈！\n\t\n新奇的滴滴小巴很方便！\n打开滴滴app，首页就能看到滴滴小巴，点进去就能叫车！\n完全“滴滴拼大车”来着，3️⃣r/人坐7座商务车超宽敞💺\n体验感可以给到夯！\n坐车路上和好朋友叽叽喳喳复盘一整天的快乐\n也不用计较路费，想逛多久逛多久😽\n好羡慕下沙大学城的宝宝们\n跨校区找朋友、出门探店都毫无压力\n低成本实现好友见面自由！🫶\n下沙的宝宝们有体验过么？\n没有的话真的超推荐感受下！\n#plog[话题]# #杭州下沙滴滴小巴[话题]# #小红书校园日记[话题]# #下沙[话题]# #研究生日常[话题]# #生活是个动词[话题]# #生动比漂亮更重要[话题]# #镜头反转记录自己[话题]# #可爱[话题]# #喜欢的照片当然要慢慢发[话题]#"",""ip_location"":""浙江"",""share_info"":{""un_share"":false},""note_id"":""6a3bac69000000000f028ff2"",""interact_info"":{""liked_count"":""65"",""collected"":false,""collected_count"":""12"",""comment_count"":""25"",""share_count"":""3"",""followed"":false,""relation"":""none"",""liked"":false},""image_list"":[{""info_list"":[{""image_scene"":""WB_PRV"",""url"":""http://sns-webpic-qc.xhscdn.com/202606250933/1a430a507775e42a2c75cc2ab678b7de/notes_pre_post/1040g3k0321puvbl5n40g5n9ig9flm8i20ucida0!nd_prv_wlteh_webp_3""},{""image_scene"":""WB_DFT"",""url"":""http://sns-webpic-qc.xhscdn.com/202606250933/2076be0d0d1112ecd3288fadeb550d1b/notes_pre_post/1040g3k0321puvbl5n40g5n9ig9flm8i20ucida0!nd_dft_wlteh_webp_3""}],""stream"":{""av1"":[],""h264"":[{""master_url"":""http://sns-video-v6.xhscdn.com/stream/1/10/19/01ea3bac5f3a6c3c010050039ef91e3167_19.mp4?sign=76a15ba28422a2732ecef51b145a5027&t=6a41228e"",""backup_urls"":[""http://sns-bak-v1.xhscdn.com/stream/1/10/19/01ea3bac5f3a6c3c010050039ef91e3167_19.mp4""]}],""h265"":[],""h266"":[]},""trace_id"":"""",""url_pre"":""http://sns-webpic-qc.xhscdn.com/202606250933/1a430a507775e42a2c75cc2ab678b7de/notes_pre_post/1040g3k0321puvbl5n40g5n9ig9flm8i20ucida0!nd_prv_wlteh_webp_3"",""url_default"":""http://sns-webpic-qc.xhscdn.com/202606250933/2076be0d0d1112ecd3288fadeb550d1b/notes_pre_post/1040g3k0321puvbl5n40g5n9ig9flm8i20ucida0!nd_dft_wlteh_webp_3"",""live_photo"":true,""file_id"":""notes_pre_post/1040g3k0321puvbl5n40g5n9ig9flm8i20ucida0"",""height"":2560,""width"":1920,""url"":""""},{""height"":1924,""width"":1440,""stream"":{""h264"":[{""master_url"":""http://sns-video-v6.xhscdn.com/stream/1/10/19/01ea3bac613142db010050039ef91df118_19.mp4?sign=72f90ac89f863083d3c4be346501b614&t=6a41228e"",""backup_urls"":[""http://sns-bak-v1.xhscdn.com/stream/1/10/19/01ea3bac613142db010050039ef91df118_19.mp4""]}],""h265"":[],""h266"":[],""av1"":[]},""url_pre"":""http://sns-webpic-qc.xhscdn.com/202606250933/29d65ccc49768c4b1159b0280e0c9131/notes_pre_post/1040g3k0321puvbl5n4105n9ig9flm8i2sg3jtj8!nd_prv_wlteh_webp_3"",""url_default"":""http://sns-webpic-qc.xhscdn.com/202606250933/211a4433575b7ae9e79409cc2ed4db4a/notes_pre_post/1040g3k0321puvbl5n4105n9ig9flm8i2sg3jtj8!nd_dft_wlteh_webp_3"",""live_photo"":true,""file_id"":""notes_pre_post/1040g3k0321puvbl5n4105n9ig9flm8i2sg3jtj8"",""url"":"""",""trace_id"":"""",""info_list"":[{""image_scene"":""WB_PRV"",""url"":""http://sns-webpic-qc.xhscdn.com/202606250933/29d65ccc49768c4b1159b0280e0c9131/notes_pre_post/1040g3k0321puvbl5n4105n9ig9flm8i2sg3jtj8!nd_prv_wlteh_webp_3""},{""image_scene"":""WB_DFT"",""url"":""http://sns-webpic-qc.xhscdn.com/202606250933/211a4433575b7ae9e79409cc2ed4db4a/notes_pre_post/1040g3k0321puvbl5n4105n9ig9flm8i2sg3jtj8!nd_dft_wlteh_webp_3""}]},{""url"":"""",""live_photo"":true,""file_id"":""notes_pre_post/1040g3k0321puvbl5n41g5n9ig9flm8i2ii254ug"",""width"":1920,""info_list"":[{""image_scene"":""WB_PRV"",""url"":""http://sns-webpic-qc.xhscdn.com/202606250933/50e4c917d3e22f74267395617e89bec0/notes_pre_post/1040g3k0321puvbl5n41g5n9ig9flm8i2ii254ug!nd_prv_wlteh_webp_3""},{""url"":""http://sns-webpic-qc.xhscdn.com/202606250933/fde2871ef16af35c4659e9b2c0811241/notes_pre_post/1040g3k0321puvbl5n41g5n9ig9flm8i2ii254ug!nd_dft_wlteh_webp_3"",""image_scene"":""WB_DFT""}],""url_pre"":""http://sns-webpic-qc.xhscdn.com/202606250933/50e4c917d3e22f74267395617e89bec0/notes_pre_post/1040g3k0321puvbl5n41g5n9ig9flm8i2ii254ug!nd_prv_wlteh_webp_3"",""url_default"":""http://sns-webpic-qc.xhscdn.com/202606250933/fde2871ef16af35c4659e9b2c0811241/notes_pre_post/1040g3k0321puvbl5n41g5n9ig9flm8i2ii254ug!nd_dft_wlteh_webp_3"",""stream"":{""h264"":[{""master_url"":""http://sns-video-v6.xhscdn.com/stream/1/10/19/01ea3bac6238cda8010050039ef91e08d4_19.mp4?sign=218b35813779cde72b11d28d8dc5231d&t=6a41228e"",""backup_urls"":[""http://sns-bak-v1.xhscdn.com/stream/1/10/19/01ea3bac6238cda8010050039ef91e08d4_19.mp4""]}],""h265"":[],""h266"":[],""av1"":[]},""height"":2560,""trace_id"":""""},{""url"":"""",""info_list"":[{""url"":""http://sns-webpic-qc.xhscdn.com/202606250933/fd02735e7f4ac1b87e3ba3790dd33a4d/notes_pre_post/1040g3k0321puvbl5n4205n9ig9flm8i27uu4im0!nd_prv_wlteh_webp_3"",""image_scene"":""WB_PRV""},{""image_scene"":""WB_DFT"",""url"":""http://sns-webpic-qc.xhscdn.com/202606250933/ce0629e0600a1ea7b18f807c6a8791d7/notes_pre_post/1040g3k0321puvbl5n4205n9ig9flm8i27uu4im0!nd_dft_wlteh_webp_3""}],""url_pre"":""http://sns-webpic-qc.xhscdn.com/202606250933/fd02735e7f4ac1b87e3ba3790dd33a4d/notes_pre_post/1040g3k0321puvbl5n4205n9ig9flm8i27uu4im0!nd_prv_wlteh_webp_3"",""height"":2560,""width"":1920,""url_default"":""http://sns-webpic-qc.xhscdn.com/202606250933/ce0629e0600a1ea7b18f807c6a8791d7/notes_pre_post/1040g3k0321puvbl5n4205n9ig9flm8i27uu4im0!nd_dft_wlteh_webp_3"",""stream"":{""h264"":[{""master_url"":""http://sns-video-v6.xhscdn.com/stream/1/10/19/01ea3bac5d314165010050039ef91dfdbc_19.mp4?sign=996aa8fd5ff16b1231b4d1bc3f673657&t=6a41228e"",""backup_urls"":[""http://sns-bak-v1.xhscdn.com/stream/1/10/19/01ea3bac5d314165010050039ef91dfdbc_19.mp4""]}],""h265"":[],""h266"":[],""av1"":[]},""live_photo"":true,""file_id"":""notes_pre_post/1040g3k0321puvbl5n4205n9ig9flm8i27uu4im0"",""trace_id"":""""},{""url_pre"":""http://sns-webpic-qc.xhscdn.com/202606250933/54d1f6c69549d08e247206e2e0bcc74f/notes_pre_post/1040g3k0321puvbl5n42g5n9ig9flm8i2p1fp9go!nd_prv_wlteh_webp_3"",""live_photo"":true,""info_list"":[{""image_scene"":""WB_PRV"",""url"":""http://sns-webpic-qc.xhscdn.com/202606250933/54d1f6c69549d08e247206e2e0bcc74f/notes_pre_post/1040g3k0321puvbl5n42g5n9ig9flm8i2p1fp9go!nd_prv_wlteh_webp_3""},{""image_scene"":""WB_DFT"",""url"":""http://sns-webpic-qc.xhscdn.com/202606250933/c5defb8b1ae170bc269847910f9d8157/notes_pre_post/1040g3k0321puvbl5n42g5n9ig9flm8i2p1fp9go!nd_dft_wlteh_webp_3""}],""url_default"":""http://sns-webpic-qc.xhscdn.com/202606250933/c5defb8b1ae170bc269847910f9d8157/notes_pre_post/1040g3k0321puvbl5n42g5n9ig9flm8i2p1fp9go!nd_dft_wlteh_webp_3"",""stream"":{""av1"":[],""h264"":[{""master_url"":""http://sns-video-v6.xhscdn.com/stream/1/10/19/01ea3bac63371740010050039ef91df999_19.mp4?sign=f22db551a9f6119bf5c88636a2d70530&t=6a41228e"",""backup_urls"":[""http://sns-bak-v1.xhscdn.com/stream/1/10/19/01ea3bac63371740010050039ef91df999_19.mp4""]}],""h265"":[],""h266"":[]},""file_id"":""notes_pre_post/1040g3k0321puvbl5n42g5n9ig9flm8i2p1fp9go"",""height"":2560,""width"":1920,""url"":"""",""trace_id"":""""},{""file_id"":""notes_pre_post/1040g3k0321puvbl5n4305n9ig9flm8i2p757320"",""width"":1920,""url"":"""",""url_pre"":""http://sns-webpic-qc.xhscdn.com/202606250933/3d203eff5d9f3099e4ce9381db4fae63/notes_pre_post/1040g3k0321puvbl5n4305n9ig9flm8i2p757320!nd_prv_wlteh_webp_3"",""url_default"":""http://sns-webpic-qc.xhscdn.com/202606250933/9382752d7ece51ced63c917145b0cda1/notes_pre_post/1040g3k0321puvbl5n4305n9ig9flm8i2p757320!nd_dft_wlteh_webp_3"",""height"":2560,""trace_id"":"""",""info_list"":[{""image_scene"":""WB_PRV"",""url"":""http://sns-webpic-qc.xhscdn.com/202606250933/3d203eff5d9f3099e4ce9381db4fae63/notes_pre_post/1040g3k0321puvbl5n4305n9ig9flm8i2p757320!nd_prv_wlteh_webp_3""},{""image_scene"":""WB_DFT"",""url"":""http://sns-webpic-qc.xhscdn.com/202606250933/9382752d7ece51ced63c917145b0cda1/notes_pre_post/1040g3k0321puvbl5n4305n9ig9flm8i2p757320!nd_dft_wlteh_webp_3""}],""stream"":{""av1"":[],""h264"":[{""master_url"":""http://sns-video-v6.xhscdn.com/stream/1/10/19/01ea3bac64425b68010050039ef91df676_19.mp4?sign=2bd65b954d1641686c79a11d8aede345&t=6a41228e"",""backup_urls"":[""http://sns-bak-v1.xhscdn.com/stream/1/10/19/01ea3bac64425b68010050039ef91df676_19.mp4""]}],""h265"":[],""h266"":[]},""live_photo"":true},{""width"":1920,""url"":"""",""info_list"":[{""image_scene"":""WB_PRV"",""url"":""http://sns-webpic-qc.xhscdn.com/202606250933/58cd3be1505e7ce7ee4fb100b15b1ba9/notes_pre_post/1040g3k0321puvbl5n43g5n9ig9flm8i2kp334a0!nd_prv_wlteh_webp_3""},{""image_scene"":""WB_DFT"",""url"":""http://sns-webpic-qc.xhscdn.com/202606250933/a2f06c0baa412d4ef68db56fcb86a4ba/notes_pre_post/1040g3k0321puvbl5n43g5n9ig9flm8i2kp334a0!nd_dft_wlteh_webp_3""}],""url_default"":""http://sns-webpic-qc.xhscdn.com/202606250933/a2f06c0baa412d4ef68db56fcb86a4ba/notes_pre_post/1040g3k0321puvbl5n43g5n9ig9flm8i2kp334a0!nd_dft_wlteh_webp_3"",""live_photo"":true,""file_id"":""notes_pre_post/1040g3k0321puvbl5n43g5n9ig9flm8i2kp334a0"",""height"":2560,""trace_id"":"""",""url_pre"":""http://sns-webpic-qc.xhscdn.com/202606250933/58cd3be1505e7ce7ee4fb100b15b1ba9/notes_pre_post/1040g3k0321puvbl5n43g5n9ig9flm8i2kp334a0!nd_prv_wlteh_webp_3"",""stream"":{""h265"":[],""h266"":[],""av1"":[],""h264"":[{""master_url"":""http://sns-video-v6.xhscdn.com/stream/1/10/19/01ea3bac65428395010050039ef91e0a93_19.mp4?sign=091efe754e751113b3cf9c39d324902a&t=6a41228e"",""backup_urls"":[""http://sns-bak-v1.xhscdn.com/stream/1/10/19/01ea3bac65428395010050039ef91e0a93_19.mp4""]}]}},{""width"":1920,""trace_id"":"""",""stream"":{""h264"":[{""master_url"":""http://sns-video-v6.xhscdn.com/stream/1/10/19/01ea3bac663a6f17010050039ef91df530_19.mp4?sign=8c36ce0b281031d5bdf4eecc92466e4a&t=6a41228e"",""backup_urls"":[""http://sns-bak-v1.xhscdn.com/stream/1/10/19/01ea3bac663a6f17010050039ef91df530_19.mp4""]}],""h265"":[],""h266"":[],""av1"":[]},""live_photo"":true,""height"":2560,""url"":"""",""info_list"":[{""image_scene"":""WB_PRV"",""url"":""http://sns-webpic-qc.xhscdn.com/202606250933/e6fe2836ed186905ba5c9ccaa06a2f79/notes_pre_post/1040g3k0321puvbl5n4405n9ig9flm8i2gfq7c70!nd_prv_wlteh_webp_3""},{""image_scene"":""WB_DFT"",""url"":""http://sns-webpic-qc.xhscdn.com/202606250933/16e1512bb86f615ab0d46d163bae8f9e/notes_pre_post/1040g3k0321puvbl5n4405n9ig9flm8i2gfq7c70!nd_dft_wlteh_webp_3""}],""url_pre"":""http://sns-webpic-qc.xhscdn.com/202606250933/e6fe2836ed186905ba5c9ccaa06a2f79/notes_pre_post/1040g3k0321puvbl5n4405n9ig9flm8i2gfq7c70!nd_prv_wlteh_webp_3"",""url_default"":""http://sns-webpic-qc.xhscdn.com/202606250933/16e1512bb86f615ab0d46d163bae8f9e/notes_pre_post/1040g3k0321puvbl5n4405n9ig9flm8i2gfq7c70!nd_dft_wlteh_webp_3"",""file_id"":""notes_pre_post/1040g3k0321puvbl5n4405n9ig9flm8i2gfq7c70""},{""trace_id"":"""",""info_list"":[{""image_scene"":""WB_PRV"",""url"":""http://sns-webpic-qc.xhscdn.com/202606250933/97be82760c0c7addfa3daa7d136f621c/notes_pre_post/1040g3k0321puvbl5n44g5n9ig9flm8i2h4ur3bg!nd_prv_wlteh_webp_3""},{""image_scene"":""WB_DFT"",""url"":""http://sns-webpic-qc.xhscdn.com/202606250933/2e68386503dfc029754fd154d2fa1c6f/notes_pre_post/1040g3k0321puvbl5n44g5n9ig9flm8i2h4ur3bg!nd_dft_wlteh_webp_3""}],""stream"":{""h266"":[],""av1"":[],""h264"":[{""backup_urls"":[""http://sns-bak-v1.xhscdn.com/stream/1/10/19/01ea3bac663a6f7d010050039ef91df022_19.mp4""],""master_url"":""http://sns-video-v6.xhscdn.com/stream/1/10/19/01ea3bac663a6f7d010050039ef91df022_19.mp4?sign=7d8a1a9d5a59dd997831472f4fbe7a60&t=6a41228e""}],""h265"":[]},""live_photo"":true,""file_id"":""notes_pre_post/1040g3k0321puvbl5n44g5n9ig9flm8i2h4ur3bg"",""height"":2560,""width"":1920,""url"":"""",""url_pre"":""http://sns-webpic-qc.xhscdn.com/202606250933/97be82760c0c7addfa3daa7d136f621c/notes_pre_post/1040g3k0321puvbl5n44g5n9ig9flm8i2h4ur3bg!nd_prv_wlteh_webp_3"",""url_default"":""http://sns-webpic-qc.xhscdn.com/202606250933/2e68386503dfc029754fd154d2fa1c6f/notes_pre_post/1040g3k0321puvbl5n44g5n9ig9flm8i2h4ur3bg!nd_dft_wlteh_webp_3""},{""width"":1264,""url"":"""",""trace_id"":"""",""info_list"":[{""image_scene"":""WB_PRV"",""url"":""http://sns-webpic-qc.xhscdn.com/202606250933/deae5f2845417a5d7c20a10a037acdaf/notes_pre_post/1040g3k0321puvbl5n4505n9ig9flm8i2198uiqo!nd_prv_wlteh_webp_3""},{""image_scene"":""WB_DFT"",""url"":""http://sns-webpic-qc.xhscdn.com/202606250933/af8a19a50c8ad402e9a5ab75d77e811b/notes_pre_post/1040g3k0321puvbl5n4505n9ig9flm8i2198uiqo!nd_dft_wlteh_webp_3""}],""file_id"":""notes_pre_post/1040g3k0321puvbl5n4505n9ig9flm8i2198uiqo"",""height"":1688,""url_pre"":""http://sns-webpic-qc.xhscdn.com/202606250933/deae5f2845417a5d7c20a10a037acdaf/notes_pre_post/1040g3k0321puvbl5n4505n9ig9flm8i2198uiqo!nd_prv_wlteh_webp_3"",""url_default"":""http://sns-webpic-qc.xhscdn.com/202606250933/af8a19a50c8ad402e9a5ab75d77e811b/notes_pre_post/1040g3k0321puvbl5n4505n9ig9flm8i2198uiqo!nd_dft_wlteh_webp_3"",""stream"":{""av1"":[],""h264"":[{""master_url"":""http://sns-video-v6.xhscdn.com/stream/1/10/19/01ea3bac6734251a010050039ef91df038_19.mp4?sign=b1778ee1000cf37d8ca5bd849c60dfbf&t=6a41228e"",""backup_urls"":[""http://sns-bak-v1.xhscdn.com/stream/1/10/19/01ea3bac6734251a010050039ef91df038_19.mp4""]}],""h265"":[],""h266"":[]},""live_photo"":true},{""width"":1920,""stream"":{""h265"":[],""h266"":[],""av1"":[],""h264"":[{""master_url"":""http://sns-video-v6.xhscdn.com/stream/1/10/19/01ea3bac68342582010050039ef91df0cf_19.mp4?sign=fd7e6ee0540f9cce5abba477e4cf6667&t=6a41228e"",""backup_urls"":[""http://sns-bak-v1.xhscdn.com/stream/1/10/19/01ea3bac68342582010050039ef91df0cf_19.mp4""]}]},""file_id"":""notes_pre_post/1040g3k0321puvbl5n45g5n9ig9flm8i2v84aqi0"",""height"":2560,""url"":"""",""trace_id"":"""",""info_list"":[{""image_scene"":""WB_PRV"",""url"":""http://sns-webpic-qc.xhscdn.com/202606250933/4d3d46e928bbf59f31aa16b5bb0a6974/notes_pre_post/1040g3k0321puvbl5n45g5n9ig9flm8i2v84aqi0!nd_prv_wlteh_webp_3""},{""image_scene"":""WB_DFT"",""url"":""http://sns-webpic-qc.xhscdn.com/202606250933/21f198b697ca761a2ff1d9a396422b28/notes_pre_post/1040g3k0321puvbl5n45g5n9ig9flm8i2v84aqi0!nd_dft_wlteh_webp_3""}],""url_pre"":""http://sns-webpic-qc.xhscdn.com/202606250933/4d3d46e928bbf59f31aa16b5bb0a6974/notes_pre_post/1040g3k0321puvbl5n45g5n9ig9flm8i2v84aqi0!nd_prv_wlteh_webp_3"",""url_default"":""http://sns-webpic-qc.xhscdn.com/202606250933/21f198b697ca761a2ff1d9a396422b28/notes_pre_post/1040g3k0321puvbl5n45g5n9ig9flm8i2v84aqi0!nd_dft_wlteh_webp_3"",""live_photo"":true},{""stream"":{""h264"":[{""master_url"":""http://sns-video-v6.xhscdn.com/stream/1/10/19/01ea3bac6938d04e010050039ef91dffda_19.mp4?sign=cd316a69d3b68045e5887254f5f356ab&t=6a41228e"",""backup_urls"":[""http://sns-bak-v1.xhscdn.com/stream/1/10/19/01ea3bac6938d04e010050039ef91dffda_19.mp4""]}],""h265"":[],""h266"":[],""av1"":[]},""live_photo"":true,""url_pre"":""http://sns-webpic-qc.xhscdn.com/202606250933/b9aa425a97d60564d0496a34fc807c13/notes_pre_post/1040g3k0321puvbl5n4605n9ig9flm8i2dj1hk0g!nd_prv_wlteh_webp_3"",""url_default"":""http://sns-webpic-qc.xhscdn.com/202606250933/b373adca948c83233f40ff37e17dab15/notes_pre_post/1040g3k0321puvbl5n4605n9ig9flm8i2dj1hk0g!nd_dft_wlteh_webp_3"",""width"":1920,""url"":"""",""trace_id"":"""",""info_list"":[{""image_scene"":""WB_PRV"",""url"":""http://sns-webpic-qc.xhscdn.com/202606250933/b9aa425a97d60564d0496a34fc807c13/notes_pre_post/1040g3k0321puvbl5n4605n9ig9flm8i2dj1hk0g!nd_prv_wlteh_webp_3""},{""image_scene"":""WB_DFT"",""url"":""http://sns-webpic-qc.xhscdn.com/202606250933/b373adca948c83233f40ff37e17dab15/notes_pre_post/1040g3k0321puvbl5n4605n9ig9flm8i2dj1hk0g!nd_dft_wlteh_webp_3""}],""file_id"":""notes_pre_post/1040g3k0321puvbl5n4605n9ig9flm8i2dj1hk0g"",""height"":2560}]}}],""current_time"":1782351182979}",12,0,"【第1张图片中的文字内容】
在下沙解锁出行新载具：
滴滴小巴
7座小车好宽敞！
完全是“滴滴拼大车”来着

【第2张图片中的文字内容】
在下沙解锁出行新载具
滴滴小巴
Il CC9
白川
M 三
7座小车好宽敞！
完全是“滴滴拼大车”来着

【第7张图片中的文字内容】
CRE
滴出行
橙色小巴很显眼诶！
好新奇呀！
滴滴小巳
me3元/A 万迎太

【第8张图片中的文字内容】
滴滴出行
橙色小巴很显眼诶！
好新奇呀！
滴滴小E
眼时优惠3元/人 下沙大学1

【第9张图片中的文字内容】
Q输入目的地
© 顶约
在滴滴上找到“滴滴小巴”
就可以啦！
去：五号路二号大街，公交站
8 需人四车
烘送肌
nd AOss（248）
打车
顺风车
代骂
站点巴士
酒派小已
滴滴宠物
柍送腕膇
借幾
青袺綺行
特价肼车
dstyle
送货 公交地铁
热门活动推荐
湎满租车
滴涧陌诊
更多朋务
vdcote 1 Cotber
元司
茶近
我的

【第10张图片中的文字内容】
Q 输入目的地
© 预约
打车
顺风车
滴滴宠物
快送跑腿
送货|
公交地铁
热门活动推荐
首页
四
车主
在滴滴上找到“滴滴小巴
去：五号路二号大街…公交站
2 帮人叫车
接送机
就可以啦！
nd Bass （D8B）
代驾
站点巴士
Q
滴滴小巴
借钱
担）
滴滴租车
青桔骑行
特价拼车
dstyle
滴滴陪诊
更多服务
rdcore / Gabber
订
票
我的",,"image 3: macOS Vision OCR failed: Error Domain=com.apple.Vision Code=13 ""CRImage Reader Detector was given zero-dimensioned image (0 x 0)"" UserInfo={NSLocalizedDescription=CRImage Reader Detector was given zero-dimensioned image (0 x 0)} | image 4: macOS Vision OCR failed: Error Domain=com.apple.Vision Code=13 ""CRImage Reader Detector was given zero-dimensioned image (0 x 0)"" UserInfo={NSLocalizedDescription=CRImage Reader Detector was given zero-dimensioned image (0 x 0)} | image 5: macOS Vision OCR failed: Error Domain=com.apple.Vision Code=13 ""CRImage Reader Detector was given zero-dimensioned image (0 x 0)"" UserInfo={NSLocalizedDescription=CRImage Reader Detector was given zero-dimensioned image (0 x 0)} | image 6: macOS Vision OCR failed: Error Domain=com.apple.Vision Code=13 ""CRImage Reader Detector was given zero-dimensioned image (0 x 0)"" UserInfo={NSLocalizedDescription=CRImage Reader Detector was given zero-dimensioned image (0 x 0)} | image 11: macOS Vision OCR failed: Error Domain=com.apple.Vision Code=13 ""CRImage Reader Detector was given zero-dimensioned image (0 x 0)"" UserInfo={NSLocalizedDescription=CRImage Reader Detector was given zero-dimensioned image (0 x 0)} | image 12: macOS Vision OCR failed: Error Domain=com.apple.Vision Code=13 ""CRImage Reader Detector was given zero-dimensioned image (0 x 0)"" UserInfo={NSLocalizedDescription=CRImage Reader Detector was given zero-dimensioned image (0 x 0)}"
