笔记ID,博主昵称,笔记链接,笔记标题,笔记内容,点赞量,收藏量,评论量,分享量,发布时间
7655579206130846181,烟火五叔（厦门流星1.0版）,https://www.iesdouyin.com/share/video/7655579206130846181#ocr,3块钱的小确幸🌟 那天凌晨3点，叫的车终于到了,"3块钱的小确幸🌟 那天凌晨3点，叫的车终于到了。司机师傅麻木地和我打招呼：“你好，为你服务。” 
半路上，我用滴滴会员红包给师傅打赏了3块钱。安静的车厢里，突然响起了打赏提示音。师傅盯着屏幕顿了1秒，像突然被什么触动了似的，又过了5分钟，问我要不要喝他刚买的气泡水。 
下车时他开心地和我道别，我回了句“谢谢大哥，辛苦了”。其实钱不多，就是份心意，互相尊重的感觉特别好——这种瞬间，彼此好像都被“滋补”到了。不过为了避免“塌房”，我可不是每次都这么打车。
对了，你有没有想到你每次打车，上飞机，坐动车，那些穿着制服的人，也是一个个有情感的活人，身上也带着各种气息能量
#会玩是成年人稀缺的超能力 #深夜vibe #磁场能量",214,0,11,1,2026-06-26 13:57:15
