笔记ID,博主昵称,笔记链接,笔记标题,笔记内容,点赞量,收藏量,评论量,分享量,发布时间
6a321d96000000001101a4e6,悦己者,https://www.xiaohongshu.com/search_result/6a321d96000000001101a4e6?xsec_token=ABNV3U1l6kOI0X3OTrYVszJOsYz-A3_6rbh2P9SxDdT7w=&xsec_source=,,自己在平台上绑定了两辆汽车，然后呢，我是通过常用路线订单接的单，这个设置常用路线的时候呢，个人是没法设置车牌的，都是它系统默认的，然后现在问题来了，他判定我为注册车牌和合乘车辆不一致，给我出了警告了呀，严重他要注销账号#顺风车[话题]# #司机[话题]# #安全出行[话题]# 哈啰 高德 滴滴,,,1,,2026-06-17 12:07:50
6a328f42000000002200a217,yan yan,https://www.xiaohongshu.com/search_result/6a328f42000000002200a217?xsec_token=ABNV3U1l6kOI0X3OTrYVszJKITeJWV3V0Gbi6HwSZMxZg=&xsec_source=,有人解释一下滴滴打车是怎么了吗,莫名其妙放一个音乐留我一个人笑的肚子痛#网约车[话题]# #滴滴出行[话题]# #日常[话题]# #猎奇[话题]#,13,1,3,9,2026-06-17 20:12:50
6a334c620000000006035cf0,睡觉吧睡觉吧,https://www.xiaohongshu.com/search_result/6a334c620000000006035cf0?xsec_token=AB3oib7tH48MvQDiWXZFlvVVoCHq0SrzemzT-H__B6Dw8=&xsec_source=,上大学打车依然要报备车牌号,"每次自己出门，不管是面试还是回学校还是出去玩，我爸都会问我要打车的车牌号，然后我就把自己的打车行程分享给他。最近一直用滴滴优先匹配女司机，比如晚上和同学吃饭晚了点，或者实习下班回学校碰上下雨天，我都用这个功能。
我跟我爸说我现在打车都优先匹配女司机，他似乎放心了点，但还是会找我要车牌号和行程分享。也不知等我再长大几岁我爸爸才能完全放心我一个人打车。
#女司机[话题]# #出租车[话题]# #大学生出行[话题]# #大学生实习[话题]# #互联网大厂[话题]# #我的实习生活[话题]# #遵守交规安全出行[话题]# #关于我打车被司机种草这件事[话题]# #通勤上下班[话题]# #实习生[话题]#",2,2,,1,2026-06-18 09:39:46
6a3276540000000007023d97,阿树的树洞,https://www.xiaohongshu.com/search_result/6a3276540000000007023d97?xsec_token=ABNV3U1l6kOI0X3OTrYVszJOS3ZfnH4P7iyJ4OH7ZFjTw=&xsec_source=,南京滴滴网约车后续，谢谢网友,#滴滴[话题]# #南京网约车[话题]# #南京发布[话题]# #南京12345[话题]# #南京旅游[话题]#,173,8,79,16,2026-06-17 18:26:28
6a3107a5000000001503f1c8,爱吃小肌鱼,https://www.xiaohongshu.com/search_result/6a3107a5000000001503f1c8?xsec_token=ABzo91c7VIfdppP7FCZM7bRGJwWAcCiHT7eNp6Mvksew4=&xsec_source=,拔完智齿打车，被女司机的细节狠狠暖到了,"下午拔了颗智齿，阻生齿，锤子凿了快四十分钟才弄出来。出来的时候左边脸肿得像个包子。
	
麻药还没完全退，整个左边下巴都是木的。站在牙科诊所门口等车，六月的太阳晒得人发晕。
	
叫了滴滴。设置里的""她计划""一直开着，给我匹配了位女司机。上车的时候我捂着脸，含糊地说了句""谢谢""。
	
她看了我一眼后视镜——然后什么都没问，伸手把副驾那边的空调出风口掰向了另一边。
	
可能看出来我捂着腮帮子怕冷。
	
这个动作太小了，小到如果我没注意根本不会发现。但那一刻鼻子真的有点酸。不是拔牙疼，是被人无声地顾到了。
	
车里干净安静。她开车很稳，路不怎么平的地方会提前减速。我靠着座位闭眼，能感觉到每一次转弯都是慢慢转过去的。
	
快到的时候她说了句：""回去记得冰敷，别喝热水。""
	
我说好。到家之后脸还是肿的，但心情是好的。
	
有时候不是多大的事让人感动，是那种你难受的时候有人懂、但不追问的体贴。
#碎碎念[话题]# #开车[话题]# #牙齿[话题]# #交通安全[话题]# #分享[话题]# #看病[话题]# #温暖[话题]# #女司机[话题]#",22,,1,,2026-06-17 17:22:01
6a320a71000000000e038400,iSaskue,https://www.xiaohongshu.com/search_result/6a320a71000000000e038400?xsec_token=ABNV3U1l6kOI0X3OTrYVszJAOs2xqXeJVTx1vcDLTRfQ4=&xsec_source=,滴滴一家独大🤫🤫,"事情是这样的：
6.5凌晨落地西安使用滴滴打车，勾选了超值出租车+特惠快车，预估价格100左右，超值出租车接单
到达后滴滴显示车费136.8+过路费6，过路费没问题，但超值出租车是一口价，和结算价差这么多，然后我就问滴滴客服原因，简要的问答如下：
	
【第一段对话】
我：超值出租车是一口价吗？
滴滴：是的
我：那为啥我这个结算价和一口价差这么多？
滴滴：您上车有指定路线之类的吗？
我：没有的，就是按照推荐的导航路线走的
滴滴：稍等我查看一下
滴滴：您勾选了特惠快车和超值出租车，系统又推荐了出租车等车型，所以价格是按照打表计价的
我：我是没有勾选的，而且我打到的车就是超值出租车
滴滴：需要授权车内录音，48小时内会有专员跟您联系
	
【第二段对话】
滴滴：针对您反馈的司机加价的问题，我们已经对司机会进行培训、并密切关注
我：我不是想问司机加价的问题，我是想问我消费前显示一口价，为什么消费后你们系统是另一个价格
滴滴：您认可6元的高速过路费吗？
我：我的问题一直不是这6元的过路费，而是消费前系统显示一口价、消费后系统显示打表价，为什么计价规格会变
滴滴：我们只是提供打车撮合服务，我们不提供运输服务
我：我问的就是你们系统处理机制，为什么一口价会变成打表价
滴滴：我们核实后48小时内回电，订单已锁定
然后我想着司机师傅大半夜接单也不容易，想着支付了再说，结果支付时发现订单已锁定、无法支付。
但是第二天滴滴系统给我自动扣款（因为我之前设置过免密支付，但是这种存在争议的金额、并且滴滴已经锁定订单了，还能通过免密支付划走我的钱）
	
隔天默默的来了个短信（见最后一个截图）
	
【第三段对话-语音客服】
我：我反馈的问题为什么没有人联系我呢？
滴滴：您反馈的是司机在车费中加了6元过路费的问题吗？
我：我反馈的是什么问题你们都不知道？然后让我等了48小时又48小时的？
滴滴：您说一下需要反馈的问题，我记录一下，48小时内给您反馈
我：（又把我的诉求说了一遍）
	
然后截至发稿、还没有滴滴客服联系我[doge][doge]，估计人家钱已经到口袋了，也就懒得管了，毕竟整个行业滴滴一家独大，压榨司机这块儿就不说了，对消费者也是搪塞了事，转个人工都得喊好几次转人工才行，唉…人家想干啥就干啥吧
	
#滴滴出行[话题]# #谁来管一管[话题]# #消费者权益[话题]##误导消费者[话题]#
@滴滴美好出发 @滴滴",1,,6,1,2026-06-17 10:46:09
6a328d05000000000702fdb8,猫多多铲屎官,https://www.xiaohongshu.com/search_result/6a328d05000000000702fdb8?xsec_token=ABNV3U1l6kOI0X3OTrYVszJOQZ167dnFMhdpOq0trVZoo=&xsec_source=,滴滴陪诊新人实训日记｜泡在医院学习的充实,"本身有护士底子，今天正式跟着团队线下实操学习，沉浸式熟悉杭州各大医院科室、挂号流程、就诊动线
从提前规划就诊路线、陪同问诊、取单缴费到术后叮嘱全流程吃透
原来专业陪诊不只是跑腿，更是给异地看病、独自就医的人满满的安全感
全程干货满满，收获直接拉满，已经迫不及待上岗服务大家啦
冲冲冲，正式加入滴滴陪诊大家庭！#滴滴陪诊[话题]# #陪诊师[话题]# #陪诊师日常[话题]#",6,5,6,4,2026-06-17 20:03:17
6a32b7f90000000021021f43,TWOTWO,https://www.xiaohongshu.com/search_result/6a32b7f90000000021021f43?xsec_token=ABNV3U1l6kOI0X3OTrYVszJNU1wdfwdte2iP6mULg7QuA=&xsec_source=,滴滴打车选女司机实际男司机,"本来就是为了图个心安晚上打车选女司机
结果来了之后是个大哥
而且头像就是女司机的专属头像
因为这是个首汽约车第三方的订单
现在滴滴和这个第三方都说自己处理不了😅",330,5,13,9,2026-06-17 23:06:34
6a32eaa80000000007028c53,Mr One,https://www.xiaohongshu.com/search_result/6a32eaa80000000007028c53?xsec_token=ABNV3U1l6kOI0X3OTrYVszJMQfKb-ibouPkTBq0iEt_vI=&xsec_source=,这个时代就像一张被严重拉开的K线图,"深夜落地杭州，坐上滴滴，和司机聊了一路。
他没有抱怨太多，但每句话都像被生活磨过一遍。平台抽成、算法陷阱，订单变少、时间越来越长，收入却越来越薄。每天都有眼睛一闭就再也睁不开了。
	
那一刻我突然觉得，这个时代就像一张被严重拉开的K线图。
	
站在上方的人，依然在讲增长、转型、周期和未来，讲产业升级，讲资源重新配置，讲所有困难都只是阶段性的阵痛。可他们一边讲着宏大叙事，一边减持、套现、离场，把账面上的繁荣兑换成真实的生活。
	
而站在K线下方的人，没有那么多关于未来的词汇。他们面对的是房租、油费、工资、债务、订单减少和越来越不确定的明天。
	
最让我失望的，不只是有人过得艰难，也不是社会存在差距。
	
真正令人失望的是，承受代价的人，往往没有表达的资格；几乎不需要承担代价的人，却总在定义什么叫“大局”，什么叫“阵痛”，什么叫“再坚持一下”。
	
他们谈的是趋势，普通人过的是日子。
	
他们说要相信未来，可很多人正在一点点失去今天。
我知道社会从来不会绝对公平，但当财富越来越集中，痛苦越来越下沉，宏大叙事往往从高处开始，代价却总由低处的人承担。
	
贫富分化不可怕，可怕的是相应的责任也在分化，财富的安全套现和个人的全身而退已成为绝大多数富人的主旋律，而本应该承担的责任，已经跟他们没有关系了",5,1,,,2026-06-18 02:42:48
6a3286dd000000001603eafa,上新铲屎官,https://www.xiaohongshu.com/search_result/6a3286dd000000001603eafa?xsec_token=ABNV3U1l6kOI0X3OTrYVszJLYMW5tTCTEK_BOsmkRw5Tg=&xsec_source=,遇见急脾气的，还不会反击,"第一件，去一个商场，找了一圈车位，后边还跟着一起找车位的几辆车，我是拐弯进停车厂门口，减速了问问保安里边有没有车位，后边直行过来的一辆奥迪大哥直接开骂，具体没太听清，好像是让我走，别停，估计是耽误他时间了。
第二件，路口右转准备进主路，主路绿灯，直行的车一辆接一辆，等了一会，找不到机会并过去，后车滴滴。其实我后边跟了好几辆，我是第一辆，压力很大，那也没辙。技术不好，安全为主，没办法只能等一会了。但是后车很着急。挺让人生气的。那我不能飞过去吧！
两个视角，作为前车或者后车，你们遇到过类似情况没？是怎么想的和处理的？或者有其他意难平的事，也可以交流一下。",4,,12,,2026-06-17 19:37:01
6a326c87000000002201acce,乐乐兔呀,https://www.xiaohongshu.com/search_result/6a326c87000000002201acce?xsec_token=ABNV3U1l6kOI0X3OTrYVszJF3zVR3f5bMoWOrAjGe8f8k=&xsec_source=,投诉无良滴滴打车 滴滴数科,"用了滴滴打车软件，在毫不知情的情况下给我开通了滴滴信用购，还擅自用信用购支付我的打车费，短信一直催促贷款还款逾期要影响征信。
	
滴滴这个无良的软件严重侵犯了我的个人隐私和知情权，擅自代表本人与重庆西岸小额贷款公司签订贷款协议用于支付打车费用！还拒绝提供本人授权滴滴开通该信用购的证明材料！坚决维权到底！抵制滴滴软件！",1,,,,2026-06-17 17:44:39
6a32a641000000000f005e81,yu,https://www.xiaohongshu.com/search_result/6a32a641000000000f005e81?xsec_token=ABNV3U1l6kOI0X3OTrYVszJJJAeH2mQDnSW5hOze5pAxo=&xsec_source=,刮到网约车 要求赔3000这种情况合理吗,右转出路口  刮到停路边的网约车 我全责 交警过来定责之后 我叫保险过来定损  其他的误工费什么费 交警说自己协商 交警一走对方就索要3000元 不给不让走 说他在东莞跑滴滴一天能跑800 维修6天  我着急送东西 转了2000给他 另外一千 对方要求3000内结清 对方这种情况怎么处理啊[哭惹R][哭惹R][哭惹R][哭惹R]#出险记录[话题]# #局部补漆[话题]# #行车安全[话题]# #开车要小心[话题]#,4,,33,,2026-06-17 21:50:57
6a32e413000000000702ca7f,顺儿,https://www.xiaohongshu.com/search_result/6a32e413000000000702ca7f?xsec_token=ABNV3U1l6kOI0X3OTrYVszJBII_ikd-7ayqtVbcUVl0zU=&xsec_source=,深圳汉普斯酒店避大雷，无法保障人身安全,事情是我和同事到深圳出差，入住了这家酒店，第二晚凌晨一点，听到门口有男生的吵闹声，还好我还在刷手机，没有睡，突然房间门锁开始发出滴滴声，这群人试图拿门卡刷我的房门，我马上开灯，并且呼叫前台，重点来了：这家酒店电话上这么多按钮，一个也 打 不 通！与此同时，外面的人还在不停的开我的房间门，滴滴声一直在响，我的手一直在发抖并一直不断的按电话上的红色的紧急服务，没有人接通！没有人！一个也没有！我的手一直在发抖，最后我打给了我同事，幸好我同事手机没有静音，帮我出门看，因为跟我同事联系上了，我就打开猫眼去看，有三个男的就在我的房间外面徘徊，其中一个还是裸着上半身，后来他们就下楼了。我都不敢想万一我同事没来，或者我房门没有反锁，我该怎么办。PS：我的房间被安排在出电梯右面，正对电梯走廊，我住之前就感觉怪怪的，果然…。另外我想知道为什么酒店电话按钮一个都打不开。大堂经理解释所有按钮都是连着前台，然后前台在忙着帮别人办入住。无力吐糟这个说法。避雷吧#酒店安全[话题]# #酒店[话题]# #深圳酒店[话题]# #酒店避雷[话题]# #不敢一个人住酒店[话题]#,5,1,3,1,2026-06-18 02:14:43
6a32864e000000000702e81f,牙尖每天穿什么,https://www.xiaohongshu.com/search_result/6a32864e000000000702e81f?xsec_token=ABNV3U1l6kOI0X3OTrYVszJI08tvdBBLrShnWXpjGDRJo=&xsec_source=,天府机场t2站G20值班的短发美女，我的神,"快到机场才发现没带护照！联系朋友帮忙送上滴滴，然后我先去托运，结果中间有一段国际航班不能无证件托运，G20值班的短发女老师提前告诉了我行走攻略，全程安抚我的情绪，告诉我如何到达登机口，耐心的说一句让我在手机备忘录记一句，感谢每一位助力本人登机梦想工作人员！#天府机场急旅客[话题]# #安全到达目的地[话题]#
	
刚刚打电话问了天府机场的客服人员，得知这位姐姐是川航的工作人员@四川航空 感谢我们四川女人！感谢天府机场t2的工作人员！",12,1,8,3,2026-06-17 19:34:38
6a32303d000000000f028ec3,小火花,https://www.xiaohongshu.com/search_result/6a32303d000000000f028ec3?xsec_token=ABNV3U1l6kOI0X3OTrYVszJIKLa4ZVZYWBZ5n1DhrbQJk=&xsec_source=,西溪谷滴滴实习租房｜1500 预算短租 3 个月,"🙋‍♀️个人情况：
在西溪谷滴滴实习，朝九晚六作息规律，不养宠物、无不良嗜好，爱干净会爱护房屋，租金按时交绝不拖沓。
📍通勤要求：
办公地在紫霞街 80 号西溪谷，通勤半小时
左右都可接受，靠近 5 号线蒋村站、浙大紫金港站或有直达公交优先。
🏠房屋硬性要求：
月租预算 1500 左右（实习工资有限，超出太多实在负担不起🥹）
必须民水民电，普通住宅性质
小区安全有门禁，环境安静不吵闹，房间朝南、白天有阳光
优先押一付一，短租 3 个月，后续看工作安排大概率可续租
只考虑房东直租 / 个人转租，中介勿扰！绝对不要串串房、劣质快装房
基础家电齐全（空调、洗衣机、热水器）
💬最后碎碎念：
第一次来杭州实习，就想找个安稳干净的小窝，靠谱房东和转租的小伙伴看看我！端午可以看房#转租[话题]# #找房[话题]# #实习生租房[话题]# #滴滴[话题]# #互联网大厂实习[话题]# #杭州[话题]# #西湖区租房[话题]# #西溪谷租房[话题]#",4,1,2,,2026-06-17 13:27:25
6a3281a40000000011010d93,忙碌的小古懂,https://www.xiaohongshu.com/search_result/6a3281a40000000011010d93?xsec_token=ABNV3U1l6kOI0X3OTrYVszJMIClksTkS9wyRKEJEPOF34=&xsec_source=,🚗新手上高速初体验｜安全感真的很重要！,"只是记录记录哈！[偷笑R][自拍R]
今天终于鼓起勇气约了陪练上高速啦～之前在驾校学的都是应试技巧，上路后完全懵圈，还好这次找的教练超有耐心！
👉陪练车带副刹真的太安心了，比坐滴滴还踏实～雨天路滑视线不好，教练全程冷静指导，连并线时机都会提前提醒。
✨最感动的是教练会讲解很多实用细节！
💡第一次开全程手心都出汗了，但成就感满满！果然有些钱该花还是得花，安全驾驶比什么都重要～
#新手上路 #安全驾驶 #陪练体验 #驾驶技巧",9,,,,2026-06-17 19:14:44
6a3234850000000021019e1c,cheesefann-,https://www.xiaohongshu.com/search_result/6a3234850000000021019e1c?xsec_token=ABNV3U1l6kOI0X3OTrYVszJD2f6jRR3Y4t8lHJLoIjSCI=&xsec_source=,交通事故理赔这样合理吗,"4月11日凌晨在中大南校门口 坐在朋友电动车后座在右边电动车车道绿灯正常行驶 一辆滴滴车跨实线变道将我和我朋友撞飞倒下路上 后面还有车流 被扶起后左腿膝盖、小腿、大脚趾疼痛难忍 遂立即报警 交警到达现场后判定对方全责 随即和朋友前往孙逸仙纪念医院就诊 x光显示没有骨折
4月11日早上 声称全责方保险理赔公司的工作人员加了我和我朋友微信 要我们发身份证、受伤部位、报销单等图片，问我们是否要一次性调解，我们拒绝
因腿部疼痛难忍无法入睡于4月14日在广东省人民医院做了mr检查，显示膝盖处有积液和软组织挫伤，同月23号腿部还是疼痛已影响到我的生活和临床工作，我又去开了泽普思和消炎药来用
（这些看病付费我都用了医保）
在5月18日，保险方给了理赔方案，因为我们是医院实习生所以没有误工费，即为医疗费（不包括医保统筹）加上个交通费等，请问这样的理赔合理吗，腿痛了一个月就赔付这么点，并且我需要做什么让他赔上我医保统筹的部分，问他有没有精神损失费营养费等，对方说只有残了死了才有
#保险理赔[话题]# #交通事故[话题]# #交通事故赔偿[话题]# #遵守交规安全出行[话题]# #不按规定车道行驶[话题]# #遵守交通法规[话题]# #车险[话题]# #中大南校[话题]# #fyp[话题]# #维护自己合法权益[话题]#",9,1,9,2,2026-06-17 13:45:41
6a32ad000000000015025a26,WEN.SHIGUANG,https://www.xiaohongshu.com/search_result/6a32ad000000000015025a26?xsec_token=ABNV3U1l6kOI0X3OTrYVszJCL9Iyr32vr8dtf43RHNDtk=&xsec_source=,6.17-Cycling（南海子公园x6）,"每次来南海子都想多骑几圈，
不为别的，只为对得起那5-7块钱的停车费。
今晚的南海子公园人超级多，什么样的牛鬼蛇神都有。
一定要注意安全，注意安全，注意安全。
偶遇胡同山野的gao老师@3w版gaoooooo 和芝麻狐老师@芝麻芝麻狐 。
	
明晚南海子绕圈继续，上车的滴滴。",16,,9,,2026-06-17 22:19:44
6a32aee6000000001603da55,Dellayyy,https://www.xiaohongshu.com/search_result/6a32aee6000000001603da55?xsec_token=ABNV3U1l6kOI0X3OTrYVszJLXHYqnRJygpCof2T2tc70Y=&xsec_source=,大疆被人偷走了怎么办……,前两天去广西阳朔旅游 回程时赶高铁太急了 大疆落在了车上 联系了滴滴司机 司机说第二天帮我寄回来 还以为这么幸运这个事情就结束了 结果第二天早上告诉我大疆被一个15岁左右的小孩偷走了……里面真的有对我来说很重要的视频[哭惹R][哭惹R]真的没招了怎么办[哭惹R]#广西阳朔[话题]# #旅游[话题]# #失物招领[话题]# #世界上还是有好多好心人的[话题]# #户外安全意识[话题]# #大疆[话题]# #大疆pock4[话题]# #小孩偷东西[话题]#,6,,4,1,2026-06-17 22:27:50
6a329c1a000000001101b01e,周行千李（80后网约车三哥的每一天）,https://www.xiaohongshu.com/search_result/6a329c1a000000001101b01e?xsec_token=ABNV3U1l6kOI0X3OTrYVszJFvy-_S7N1r2ZM-2qlxUgu8=&xsec_source=,滴滴网约车第五天,"今天是第五天，新手滴滴车主，不管什么单都接，然后都是特小单，7块8块，问了乘客，他们都是付的9块10块，平台抽成20%，狗都不接我接。今天二个乘客取消了订单，很郁闷，堵车去接，都到了给取消了。然后市中心一直在接起步价七八块的单，每个单子要堵半小时，红绿灯还多，问老司机说平台控流水。流水大家看，有问题留言大家建议讨论一下
#网约车[话题]##滴滴司机日常[话题]##滴滴租车[话题]##滴滴车主[话题]##网约车司机[话题]##网约车坑不坑[话题]##中年男人的快乐[话题]##为了生活继续向前钱冲[话题]#",,,4,,2026-06-17 21:07:38
